{
  "command": [
    "pulsecrawl-research",
    "run",
    "S01",
    "--phase",
    "confirmatory"
  ],
  "completedAt": "2026-10-26T05:40:10.577758+00:00",
  "configuration": {
    "concurrency": 8,
    "maximumDepth": 6,
    "maximumUrls": 50
  },
  "executionId": "20261026T053954Z-s01-d5839359",
  "experimentId": "execution-budget-under-concurrency",
  "inputs": {
    "artifactRelease": "0.3.0",
    "checksumsSha256": "bdf18de67795693b5d68e35009f74f8c1e898f55cb4c3a7242f3f0c3ddc18d59",
    "sourceRelease": "public-local-0.1.0-2026-10-27",
    "sourceRepositoryCommit": "ca95ec21827c73205fc87480a906ed388e101097",
    "sourceRunChecksumsSha256": "3334c8ce46bf085f1a8f8b9aee77394a43977109746448fc71af59d2b4a4d713"
  },
  "notes": [
    "The shell invocation is reconstructed from the registered release procedure; the source run did not retain a shell transcript.",
    "This public directory excludes raw workspaces, downloaded HTML, and machine-specific environment fields."
  ],
  "outputs": {
    "checksums": "checksums.sha256",
    "measurements": "measurements.json",
    "summary": "summary.json"
  },
  "schemaVersion": 1,
  "software": {
    "platform": "macOS-arm64",
    "pulsecrawl": "0.1.0",
    "python": "3.11.9"
  },
  "startedAt": "2026-10-26T05:39:54.968256+00:00",
  "status": "completed"
}
