{
  "command": [
    "pulsecrawl-research",
    "run",
    "S04",
    "--phase",
    "confirmatory"
  ],
  "completedAt": "2026-10-26T06:12:27.680376+00:00",
  "configuration": {
    "concurrency": 4,
    "maximumDepth": 5,
    "maximumUrls": 30
  },
  "executionId": "20261026T061214Z-s04-e509de03",
  "experimentId": "robots-request-controls",
  "inputs": {
    "artifactRelease": "0.3.0",
    "checksumsSha256": "bdf18de67795693b5d68e35009f74f8c1e898f55cb4c3a7242f3f0c3ddc18d59",
    "sourceRelease": "public-local-0.1.0-2026-10-27",
    "sourceRepositoryCommit": "ca95ec21827c73205fc87480a906ed388e101097",
    "sourceRunChecksumsSha256": "97142857a771af39d93df4178867fd82494da63ffb10384314268f8cfc623bc7"
  },
  "notes": [
    "The shell invocation is reconstructed from the registered release procedure; the source run did not retain a shell transcript.",
    "This public directory excludes raw workspaces, downloaded HTML, and machine-specific environment fields."
  ],
  "outputs": {
    "checksums": "checksums.sha256",
    "measurements": "measurements.json",
    "readableMeasurements": "measurements.csv",
    "summary": "summary.json"
  },
  "schemaVersion": 1,
  "software": {
    "platform": "macOS-arm64",
    "pulsecrawl": "0.1.0",
    "python": "3.11.9"
  },
  "startedAt": "2026-10-26T06:12:14.645627+00:00",
  "status": "completed"
}
