{
  "command": [
    "pulsecrawl-research",
    "run",
    "D08",
    "--phase",
    "confirmatory"
  ],
  "completedAt": "2026-10-26T06:13:27Z",
  "configuration": {
    "interruptionPoints": [
      "before_compaction",
      "after_replacement_write",
      "during_version_pointer_write",
      "after_version_swap",
      "after_cleanup"
    ],
    "repetitions": 30
  },
  "executionId": "20261026T061327Z-d08-a3a98978",
  "experimentId": "compaction-interruption-matrix",
  "inputs": {
    "artifactRelease": "0.3.0",
    "checksumsSha256": "bdf18de67795693b5d68e35009f74f8c1e898f55cb4c3a7242f3f0c3ddc18d59",
    "sourceRelease": "public-local-0.1.0-2026-10-27",
    "sourceRepositoryCommit": "ca95ec21827c73205fc87480a906ed388e101097",
    "sourceRunChecksumsSha256": "1bba864f535d838840b8c5cbb8428677dcdb6c748525675b7bbd1263a6f9f741"
  },
  "notes": [
    "The shell invocation is reconstructed from the registered release procedure; the source run did not retain a shell transcript.",
    "This public directory excludes raw workspaces, downloaded HTML, and machine-specific environment fields."
  ],
  "outputs": {
    "checksums": "checksums.sha256",
    "measurements": "measurements.json",
    "summary": "summary.json"
  },
  "schemaVersion": 1,
  "software": {
    "platform": "macOS-arm64",
    "pulsecrawl": "0.1.0",
    "python": "3.11.9"
  },
  "startedAt": "2026-10-26T06:13:27Z",
  "status": "completed"
}
