{
  "command": [
    "pulsecrawl-research",
    "run",
    "S03",
    "--phase",
    "confirmatory"
  ],
  "completedAt": "2026-10-26T05:51:18Z",
  "configuration": {
    "localPacingGroups": 2,
    "maximumUrlsPerJob": 20,
    "originRequestsPerSecond": 2,
    "parallelJobs": 3
  },
  "executionId": "20261026T055118Z-s03-fd7f5983",
  "experimentId": "shared-origin-pacing",
  "inputs": {
    "artifactRelease": "0.3.0",
    "checksumsSha256": "bdf18de67795693b5d68e35009f74f8c1e898f55cb4c3a7242f3f0c3ddc18d59",
    "sourceRelease": "public-local-0.1.0-2026-10-27",
    "sourceRepositoryCommit": "ca95ec21827c73205fc87480a906ed388e101097",
    "sourceRunChecksumsSha256": "282d0f4c89dfaea5b7be042c0429467f57aa69eeb4476d2b328720dc27b06331"
  },
  "notes": [
    "The shell invocation is reconstructed from the registered release procedure; the source run did not retain a shell transcript.",
    "This public directory excludes raw workspaces, downloaded HTML, and machine-specific environment fields."
  ],
  "outputs": {
    "checksums": "checksums.sha256",
    "measurements": "measurements.json",
    "readableMeasurements": "measurements.csv",
    "summary": "summary.json"
  },
  "schemaVersion": 1,
  "software": {
    "platform": "macOS-arm64",
    "pulsecrawl": "0.1.0",
    "python": "3.11.9"
  },
  "startedAt": "2026-10-26T05:51:18Z",
  "status": "completed"
}
