{
  "command": [
    "pulsecrawl-research",
    "run",
    "D11",
    "--phase",
    "confirmatory"
  ],
  "completedAt": "2026-10-26T06:13:27Z",
  "configuration": {
    "executions": 10,
    "publicationPolicies": [
      "append_all",
      "new_urls_only"
    ],
    "urls": 100
  },
  "executionId": "20261026T061327Z-d11-cfe1dc02",
  "experimentId": "public-workspace-publication",
  "inputs": {
    "artifactRelease": "0.3.0",
    "checksumsSha256": "bdf18de67795693b5d68e35009f74f8c1e898f55cb4c3a7242f3f0c3ddc18d59",
    "sourceRelease": "public-local-0.1.0-2026-10-27",
    "sourceRepositoryCommit": "ca95ec21827c73205fc87480a906ed388e101097",
    "sourceRunChecksumsSha256": "5c1eaa41237aa6d24ad7279acb313a4deac957cde98160133ad09e55b55e332d"
  },
  "notes": [
    "The shell invocation is reconstructed from the registered release procedure; the source run did not retain a shell transcript.",
    "This public directory excludes raw workspaces, downloaded HTML, and machine-specific environment fields."
  ],
  "outputs": {
    "checksums": "checksums.sha256",
    "measurements": "measurements.json",
    "readableDataset": "readable-output/export-manifest.json",
    "readableMeasurements": "measurements.csv",
    "summary": "summary.json"
  },
  "schemaVersion": 1,
  "software": {
    "platform": "macOS-arm64",
    "pulsecrawl": "0.1.0",
    "python": "3.11.9"
  },
  "startedAt": "2026-10-26T06:13:27Z",
  "status": "completed"
}
