{
  "command": [
    "pulsecrawl-research",
    "run",
    "S05",
    "--phase",
    "confirmatory"
  ],
  "completedAt": "2026-10-26T06:21:11Z",
  "configuration": {
    "concurrency": 16,
    "maximumUrls": 1000,
    "profiles": [
      "worker_wait",
      "queue_defer",
      "scheduled_eligibility",
      "scheduled_eligibility_with_final_gate"
    ]
  },
  "executionId": "20261026T062111Z-s05-377680b2",
  "experimentId": "deferred-work-efficiency",
  "inputs": {
    "artifactRelease": "0.3.0",
    "checksumsSha256": "bdf18de67795693b5d68e35009f74f8c1e898f55cb4c3a7242f3f0c3ddc18d59",
    "sourceRelease": "public-local-0.1.0-2026-10-27",
    "sourceRepositoryCommit": "ca95ec21827c73205fc87480a906ed388e101097",
    "sourceRunChecksumsSha256": "796bdfb5b0736945a4c2ef0de2b1ca6e08eaaa60efff5a297fcdf423c1e883b4"
  },
  "notes": [
    "The shell invocation is reconstructed from the registered release procedure; the source run did not retain a shell transcript.",
    "This public directory excludes raw workspaces, downloaded HTML, and machine-specific environment fields."
  ],
  "outputs": {
    "checksums": "checksums.sha256",
    "measurements": "measurements.json",
    "readableMeasurements": "measurements.csv",
    "summary": "summary.json"
  },
  "schemaVersion": 1,
  "software": {
    "platform": "macOS-arm64",
    "pulsecrawl": "0.1.0",
    "python": "3.11.9"
  },
  "startedAt": "2026-10-26T06:21:11Z",
  "status": "completed"
}
