{
  "command": [
    "pulsecrawl-research",
    "run",
    "D02",
    "--phase",
    "confirmatory"
  ],
  "completedAt": "2026-10-26T06:13:26Z",
  "configuration": {
    "executions": 100,
    "newFraction": 0.05,
    "rowsPerExecution": 1000
  },
  "executionId": "20261026T061326Z-d02-b82cd01c",
  "experimentId": "new-url-materialization",
  "inputs": {
    "artifactRelease": "0.3.0",
    "checksumsSha256": "bdf18de67795693b5d68e35009f74f8c1e898f55cb4c3a7242f3f0c3ddc18d59",
    "sourceRelease": "public-local-0.1.0-2026-10-27",
    "sourceRepositoryCommit": "ca95ec21827c73205fc87480a906ed388e101097",
    "sourceRunChecksumsSha256": "83123f04e63b3a70340eb96a326453057c7bcd8b290ff76837139fedf2bcd867"
  },
  "notes": [
    "The shell invocation is reconstructed from the registered release procedure; the source run did not retain a shell transcript.",
    "This public directory excludes raw workspaces, downloaded HTML, and machine-specific environment fields."
  ],
  "outputs": {
    "checksums": "checksums.sha256",
    "measurements": "measurements.json",
    "summary": "summary.json"
  },
  "schemaVersion": 1,
  "software": {
    "platform": "macOS-arm64",
    "pulsecrawl": "0.1.0",
    "python": "3.11.9"
  },
  "startedAt": "2026-10-26T06:13:26Z",
  "status": "completed"
}
